{"asset_id":"asset_golden","asset_revision_id":"asset_revision_golden","project_id":"project_golden","original_name":"fixture.png","original_sha256":"aaaaaaaaaaaaaaaaaaaaaaaaaaaaaaaaaaaaaaaaaaaaaaaaaaaaaaaaaaaaaaaa","canonical_sha256":"bbbbbbbbbbbbbbbbbbbbbbbbbbbbbbbbbbbbbbbbbbbbbbbbbbbbbbbbbbbbbbbb","canonical_width":640,"canonical_height":480,"exif_orientation":1,"original_to_canonical":[1.0,0.0,0.0,0.0,1.0,0.0,0.0,0.0,1.0],"source_group_id":"source_golden"}